Question,Scenario,Choice_A,Choice_B,Choice_C,Choice_D,Correct_Answer,Explanation,Source
What is the best ground for objecting to this question?,"A plaintiff sued a defendant for damages for back injuries received in a car wreck.  The defendant disputed the damages and sought to prove that the plaintiff’s disability, if any, resulted from a childhood horseback riding accident.  The plaintiff admitted the childhood accident but contended it had no lasting effect.

The plaintiff calls an orthopedist who had never examined the plaintiff and poses to the orthopedist a hypothetical question as to the cause of the disability that omits any reference to the horseback riding accident.  The question was not provided to opposing counsel before trial.",Hypothetical questions are no longer permitted.,Sufficient notice of the hypothetical question was not given to opposing counsel before trial.,The hypothetical question omitted a clearly significant fact.,The orthopedist lacked firsthand knowledge concerning the plaintiff’s condition.,C,,
Should the court admit the expert’s testimony?,"A plaintiff sued the manufacturer of his lawn mower, alleging that, as the result of a design defect, he was injured when the mower’s blade flew off after striking a sprinkler head in the lawn.

At trial, the manufacturer has called as an expert witness a product safety engineer, who testifies that the manufacturer retained him for a fee to test identical mowers and, if his opinion was helpful, to testify in the case.  The expert then testifies that he did test the mowers, and that the blade, as designed and installed by the manufacturer, could not fly off in the manner claimed by the plaintiff.  Assume that the expert has used a reliable method for reaching his conclusion.","No, because it goes to an ultimate issue that only the jury can decide.","No, because the manufacturer paid the expert to render a certain opinion, in violation of rules barring paid testimony.","Yes, because expert testimony on such issues of causation is relevant and helpful to the jury.","Yes, provided that the plaintiff had notice and an opportunity to participate in the testing process.",C,,
Should the expert’s opinion be admitted?,"At a defendant’s trial for drug dealing, a prosecution witness testified that he had heard the defendant telling a group of people to come to the defendant’s house because he had “a great crop of apples for sale.”  The prosecutor then called and qualified a drug enforcement agent as an expert in how drug dealing is conducted.  The prosecutor now seeks to have the expert testify that in her opinion, based on years of experience with drug dealers, the defendant’s statement about the apples was code for his having drugs for sale.","No, because an expert must base his or her opinion on scientific or technical data, not merely on experience.","No, because the opinion is based on the criminal actions of others engaged in drug dealing, and thus is substantially more unfairly prejudicial than probative.","Yes, because the opinion is based on her specialized knowledge, and it will assist the trier of fact in understanding the evidence and determining facts in issue in the case.","Yes, provided that the expert first testifies about the specific information upon which she based her view that the defendant was using ""apples"" as a code word to refer to drugs.",C,,
Should the court allow the defendant’s question?,"A plaintiff, the owner of a condominium building, sued a defendant, a young architect, in federal court.  The plaintiff alleged that the defendant was negligent in designing the plaintiff’s building and that defects in the building’s structural design rendered it unsafe and uninhabitable.  At trial, the plaintiff called a structural engineer as an expert witness and asked her several questions about her education and experience.  The court found that the engineer was qualified to testify as an expert and permitted her to offer an opinion on the soundness of the building’s design.  On cross-examination, the defendant asked the engineer if it was true that she had failed three engineering classes while in graduate school.  The plaintiff has objected to the question.","No, because the court already decided that the engineer is an expert.","No, because the engineer’s character has not been placed in issue.","Yes, because a party may inquire into specific instances of conduct that bear on a witness’s truthfulness during cross-examination.","Yes, because it goes to the weight to be given to the engineer’s testimony.",D,,
Should the court allow the plaintiff’s expert to testify at trial?,"A plaintiff who lives near a factory has sued the company that owns it, alleging that a toxin released from the factory caused the plaintiff to suffer a respiratory disease.  The company contends that only a small amount of the toxin was released for a brief period, and that in any event the toxin is not known to cause any respiratory disease.  The plaintiff has not disputed the minimal amount and brief length of the exposure.

At trial, the plaintiff seeks to call an expert who will testify that in her opinion the toxin released from the factory caused the plaintiff’s respiratory disease.  The company has objected to the admission of the expert’s testimony.

At a pretrial hearing to determine the admissibility of the expert’s testimony, the expert testified that she based her opinion on several studies provided by the plaintiff’s attorney about another substance that is similar to the toxin at issue.  These studies show that prolonged exposure to high doses of the similar substance can cause the respiratory disease that the plaintiff suffers from.  On cross-examination, the company’s attorney elicits from the expert an admission that she did not consider, in forming her opinion, two recent clinical studies, both of which concluded that there was no connection between the toxin at issue and any respiratory disease.","No, because the expert is relying on studies that she read for purposes of preparing her testimony in this litigation.","No, because the plaintiff has failed to show by a preponderance of the evidence that the expert based her opinion on sufficient facts and data and that she employed a reliable methodology.","Yes, because the company has not met its burden of showing that the expert’s opinion is unreliable.","Yes, because the sufficiency of an expert’s basis for an opinion and the reliability of an expert’s methodology are questions of weight for the jury.",B,,
What is the proper ruling for the court to make?,"A defendant has been indicted for shooting a gun at a local official.  She has raised an insanity defense.  At trial, the defendant’s attorney seeks to call a qualified psychiatrist as an expert witness.  The psychiatrist would testify (1) that at the time of the shooting the defendant suffered from schizophrenia and heard voices commanding her to shoot the official, and (2) that because of these auditory hallucinations, the defendant was legally insane at the time of the shooting.  The prosecutor objects to the proposed testimony.","The psychiatrist’s testimony is admissible in its entirety, because it will be helpful to the jury.","The psychiatrist’s testimony is admissible in its entirety, because the bar on expert testimony about a criminal defendant’s mental state applies to the prosecution’s expert witnesses only.","The psychiatrist’s testimony regarding the defendant’s schizophrenia and auditory hallucinations is admissible, but the testimony about whether the defendant was legally insane at the time of the shooting is inadmissible.","The psychiatrist’s testimony is inadmissible in its entirety, because an expert witness may not testify about a criminal defendant’s mental state.",C,,
Will production of the report be required?,A woman sued a car manufacturer alleging that she was seriously injured when a defect in her car’s engine caused it to seize while the car was in motion.  The manufacturer’s chief engineer prepared a report on the engine’s production history and failure rate at the request of the manufacturer’s attorney in preparation for trial.  The report was then delivered to the attorney.  The woman demands that the report be produced during discovery.,"No, because it is a privileged attorney-client communication.","No, because the report contains hearsay.","No, because the report is self-serving.","Yes, because business reports are not privileged.",A,,In-Class MBE
Can the attorney be required to produce the letter?,"In a federal investigation of a defendant for tax fraud, the grand jury seeks to obtain a letter written January 15 by the defendant to her attorney in which she stated: “Please prepare a deed giving my ranch to the university specified herein.  But, in order to get around the tax law, I want it back-dated to December 15.”

The attorney refuses to produce the letter on the ground of privilege.","No, because the statement is protected by the attorney-client privilege.","No, because the statement is protected by the client’s privilege against self-incrimination.","Yes, because the attorney-client privilege belongs to the client and can be claimed only by her.","Yes, because the statement was in furtherance of crime or fraud.",D,,In-Class MBE
Is the attorney’s testimony privileged?,A defendant is on trial for the crime of obstructing justice by concealing records that were subpoenaed in a government investigation.  The government calls the defendant’s attorney to testify that the defendant contacted the attorney and asked him how to comply with the regulations regarding the transfer of records to a safe-deposit box in Mexico.  The defendant’s purpose in seeking the attorney’s advice was to avoid those restrictions.,"No, provided the attorney knew the advice was sought for an illegal purpose.","No, whether or not the attorney knew the advice was sought for an illegal purpose.","Yes, because an attorney is required to keep the confidences of his clients.","Yes, because it relates to conduct outside the jurisdiction of the United States.",B,,In-Class MBE
Should the court uphold the defendant’s privilege claim?,"A plaintiff sued a defendant in federal court in connection with the dissolution of a franchise.  In response to the plaintiff’s request for production, the defendant provided his attorney with thousands of documents pertaining to the franchise.  Included in those documents was a letter that the defendant had written to his attorney, which discussed the defendant’s understanding of the agreement to dissolve the franchise.  The defendant, prior to sending the letter, had shown it to his nephew to gain his support regarding the matter.  Before producing these documents to the plaintiff, the defendant’s attorney took reasonable steps to redact any privileged information but did not notice the defendant’s letter.  As a result, the letter was turned over to the plaintiff.  The defendant’s attorney later learned of the inadvertent disclosure but did nothing to rectify the error.

The plaintiff seeks to introduce the letter into evidence at trial.  The defendant has objected, invoking the attorney-client privilege.","No, because the defendant’s attorney waived the privilege by failing to take reasonable steps to rectify the error.","No, because the letter was disclosed to the defendant’s nephew and therefore is not privileged.","Yes, because the defendant holds the privilege and the attorney cannot waive the privilege on the defendant’s behalf.","Yes, because the defendant’s attorney may claim the privilege on the defendant’s behalf.",B,,In-Class MBE
Is the man’s motion likely to be granted?,"A man was prosecuted in federal court for making threats against the President of the United States.  The man was a voluntary patient in a private psychiatric hospital and told a nurse, shortly before the President came to town, that he planned to shoot the President.  The nurse reported the threat to FBI agents.  The man filed a motion to prevent the nurse from testifying.","No, because the man had not been committed involuntarily by court order.","No, because the statement was not within any privilege.","Yes, because the nurse violated a confidence in reporting the statement.","Yes, because the statement was made in a medical setting.",B,,In-Class MBE
Should the wife be required to testify?,"A defendant has pleaded not guilty to a federal bank robbery charge.

The principal issue at trial is the identity of the robber.  The prosecutor has called the defendant’s wife to testify to the clothing that the defendant wore as he left their house on the day the bank was robbed, expecting her description to match that of eyewitnesses to the robbery.  Both the defendant and his wife have objected to her testifying against the defendant.
","No, because the defendant has a privilege to prevent his wife from testifying against him in a criminal case.","No, because the wife has a privilege not to testify against her husband in a criminal case.","Yes, because the spousal testimonial privilege does not apply in criminal cases.","Yes, because the wife’s viewing of the defendant’s clothing was not a confidential communication.",B,,In-Class MBE
The defendant objects to his wife’s testimony.  Should the testimony be admitted?,"A defendant has been charged with making a false statement to a federally insured financial institution to secure a loan.  At trial, the prosecutor calls the defendant’s wife as a willing witness to testify that the defendant told her in confidence that he had misrepresented his assets on the loan application.","No, because even though the wife is a willing witness, the defendant has the right to exclude confidential marital communications in federal court.","No, but only if the law of the state where the defendant and his wife reside recognizes a privilege for confidential marital communications.","Yes, because in federal court the right not to testify belongs to the testifying spouse, and she is a willing witness.","Yes, because while the adverse testimonial privilege is recognized in federal court, the marital communications privilege is not.",A,,In-Class MBE