Question,Scenario,Choice_A,Choice_B,Choice_C,Choice_D,Correct_Answer,Explanation,Source
Should the testimony be admitted?,"A defendant was charged with the crime of defrauding the federal agency where he worked as an accountant.  At trial, the court allowed the defendant to call his supervisor at the large corporation where he had previously worked, who testified about the defendant’s good reputation in the community for honesty.  Over objection, the defendant then sought to elicit testimony from his former supervisor that on several occasions the corporation had, without incident, entrusted him with large sums of money.","No, because good character cannot be proved by specific instances of conduct unless character is an essential element of the charge or defense.","No, because the testimony is extrinsic evidence on a collateral matter.","Yes, because it is evidence of a pertinent character trait offered by an accused.","Yes, because it is relevant to whether the defendant was likely to have taken money as charged in this case.",A,,In-Class MBE
How should the court proceed?,"A defendant was charged with battery for allegedly attacking a man after the two of them left a local bar together.  No one else witnessed the incident.  At trial, each testified that he had acted only in self-defense.  The defendant has called his next-door neighbor as a witness to testify to the defendant’s reputation both for truthfulness and for peacefulness.  The government has objected to the testimony in its entirety.",Admit the evidence in its entirety.,"Admit the evidence regarding the defendant's reputation for peacefulness, but exclude the evidence regarding his truthfulness.","Exclude the evidence regarding the defendant's reputation for peacefulness, but admit the evidence regarding his truthfulness.",Exclude the evidence in its entirety.,B,,In-Class MBE
Should the testimony be admitted?,"A man and his neighbor were involved in an ongoing dispute over loud parties frequently held at the neighbor’s home.  One morning, after the neighbor hosted a particularly raucous affair, the man approached the neighbor and a fight ensued.

The man was charged with assault.  At trial, the man did not take the stand but sought to offer opinion evidence of his good character for truth and honesty.","No, because character cannot be used to prove conduct in conformity therewith.","No, because the testimony is evidence of a trait not pertinent to the case.","Yes, because a criminal defendant may always offer evidence of his good character.","Yes, because a party's credibility is in issue.",B,,In-Class MBE
Is this evidence admissible?,"A defendant is on trial for the murder of his father.  The defendant’s defense is that he shot his father accidentally.

The prosecutor calls a police officer to testify that on two occasions in the year prior to this incident, he had been called to the defendant’s home because of complaints of loud arguments between the defendant and his father, and had found it necessary to stop the defendant from beating his father.","No, because it is improper character evidence.","No, because the police officer lacks firsthand knowledge of who started the quarrels.","Yes, to show that the defendant is a violent person.","Yes, to show that the defendant killed his father intentionally.",D,,In-Class MBE
"On the issue of giving notice, is the letter copy admissible?","A construction company sued a developer for money owed on a cost-plus contract that required notice of proposed expenditures beyond original estimates.  The developer asserted that it never received the required notice.

At trial the construction company calls its general manager to testify that it is the construction company’s routine practice to send cost overrun notices as required by the contract.  The manager also offers a photocopy of the cost overrun notice letter to the developer on which the construction company is relying, and which he has taken from the construction company’s regular business files.","No, because it is hearsay not within any exception.","No, because it is not the best evidence of the notice.","Yes, because of the routine practices of the company.","Yes, though hearsay, under the business record exception.",C,,In-Class MBE
Is this evidence admissible?,"A man was charged with armed robbery of a store and denied that he was the person who had robbed the store.  In presenting the state’s case, the prosecutor seeks to introduce evidence that the man had robbed two other stores in the past year.","No, because character must be proved by reputation or opinion and may not be proved by specific acts.","No, because its probative value is substantially outweighed by the danger of unfair prejudice.","Yes, to prove a pertinent trait of the man's character and the man's action in conformity therewith.","Yes, to prove the man's identity.",B,,In-Class MBE
Is this testimony regarding the man's conduct during the three prior arrests admissible?,"A man has sued a police officer, alleging that the officer violated the man’s civil rights by using excessive force while arresting him.  At trial, the officer admits having hit the man in the head with the butt of his gun but contends that the force was necessary, because the man was resisting arrest.  In support of his contention, the officer seeks to introduce evidence that the man had resisted arrest on three prior occasions during the last 10 years.","No, because evidence of the prior incidents constitutes impermissible character evidence.","No, because the officer has not shown that the man was convicted in connection with the prior incidents.","Yes, because the incidents in question are relevant evidence of the man's propensity for violence.","Yes, because the incidents in question are sufficient to constitute a habit.",A,,In-Class MBE
Is the witness’s testimony admissible?,"A factory worker is charged with criminal assault on his manager after losing money to the manager during a game of poker.  The factory worker testified that he struck the manager while acting in self-defense.  The state now seeks to call a witness to testify that, on two prior occasions, the witness saw the factory worker assault someone without provocation after a poker game and thereafter falsely claim self-defense.","No, because it is improper character evidence.","No, because it is not relevant.","Yes, as evidence of the factory worker's violent nature.","Yes, as evidence that the factory worker did not act in self-defense on this occasion.",D,,In-Class MBE
How should the court proceed?,"A plaintiff sued a defendant for civil battery.  At trial, the defendant testified that he was nowhere near the plaintiff when the plaintiff sustained the injuries at issue.  The defendant now seeks to call a witness to testify to the defendant’s reputation for both peacefulness and truthfulness.  The plaintiff has objected to the testimony.","Admit the testimony in its entirety, because evidence concerning a defendant's character is always admissible.","Admit the testimony regarding the defendant's reputation for peacefulness, but exclude the testimony regarding his reputation for truthfulness.","Exclude the testimony regarding the defendant's reputation for peacefulness, but admit the testimony regarding his reputation for truthfulness.","Exclude the testimony in its entirety, because this is a civil suit and the defendant's character for truthfulness was not attacked.",D,,In-Class MBE
Is the roommate’s testimony admissible?,"A defendant was charged with manufacturing methamphetamine with intent to distribute.  At the defendant's trial, the prosecutor calls the defendant’s college roommate.  The roommate will testify that when he and the defendant were in college, eight years before the trial, he saw the defendant use cocaine on several occasions while studying for finals.  The defendant objects to the roommate’s testimony.","No, because it is improper character evidence.","No, because the defendant was never convicted of the previous acts.","Yes, because it is probative of intent, and intent is an element of the charged crime.","Yes, because it is probative of the defendant's knowledge about drugs.",A,,In-Class MBE
Is the defendant’s statement admissible?,"A plaintiff has sued a defendant for personal injuries the plaintiff suffered when she was bitten as she was trying to feed a rat that was part of the defendant’s caged-rat experiment at a science fair.  At trial, the plaintiff offers evidence that immediately after the incident the defendant said to her, “I’d like to give you this $100 bill because I feel so bad about this.”","No, because it is not relevant to the issue of liability.","No, because it was an offer of compromise.","Yes, as a present sense impression.","Yes, as the statement of a party-opponent.",D,,In-Class MBE
Is the witness’s testimony admissible?,"At a woman’s trial for bank robbery, the prosecutor has called a private security guard for the bank who has testified, without objection, that while he was on a coffee break, the woman’s brother rushed up to him and said, “Come quickly!  My sister is robbing the bank!”  The woman now seeks to call a witness to testify that the brother later told the witness, “I got my sister into trouble by telling a security guard that she was robbing the bank, but now I realize I was mistaken.”  The brother is unavailable to testify.","No, because the brother will be afforded no opportunity to explain or deny the later statement.","No, because the prosecutor will be afforded no opportunity to confront the brother.","Yes, because it is substantive proof that the woman did not rob the bank.","Yes, but only as an inconsistent statement to impeach the brother’s credibility.",D,,In-Class MBE
Is the homeowner’s testimony regarding the plumber’s response admissible?,"A homeowner sued a plumber for damages resulting from the plumber’s allegedly faulty installation of water pipes in her basement, which caused flooding.  At trial, the homeowner is prepared to testify that when she first detected the flooding, she turned off the water and called the plumber at his emergency number for help and that the plumber responded, “I’ll come by tomorrow and redo the installation for free.”","No, because it is hearsay not within any exception.","No, because the statement was an offer in compromise.","Yes, as a subsequent remedial measure.","Yes, as evidence of the plumber’s fault.",D,,In-Class MBE
Why is the cyclist’s testimony relating what the defendant’s employee said at the hospital admissible to prove negligence?,"A cyclist sued a defendant corporation for injuries sustained when she was hit by a truck owned by the defendant and driven by its employee, who was making deliveries for the defendant.  The day after the accident, the employee visited the cyclist in the hospital and said, “I’m sorry for what I did.”

At trial, the employee has testified that he exercised due care.",It is a prior inconsistent statement.,It is a statement against interest.,It is a statement by a party-opponent’s agent.,It is a statement of then-existing state of mind.,C,,In-Class MBE
How should the court rule on the admissibility of the plaintiff’s testimony?,A plaintiff sued a defendant for copyright infringement because the defendant’s book contained some slightly disguised house plans on which the plaintiff held the copyright.  The plaintiff is prepared to testify that he heard the defendant’s executive assistant for copyright matters say that the defendant had obtained an advance copy of the plans from the plaintiff’s office manager.  The defendant’s attorney objects.,The testimony is admissible as a statement of a coconspirator.,The testimony is admissible as a statement of an employee of a party-opponent.,"The testimony is inadmissible, because it is hearsay not within any exception.","The testimony is inadmissible, because there is no showing that the assistant was authorized to speak for the defendant.",B,,In-Class MBE
Is the witness’s testimony in the criminal trial admissible in the civil action?,"A defendant was indicted for engaging in a fraudulent investment scheme.  At the criminal trial, the prosecutor called a witness who had participated in the scheme with the defendant.  The witness testified about the operation of the scheme and was cross-examined by the defendant’s attorney.  The case resulted in a mistrial.

An investor who was allegedly defrauded by the scheme has now brought a civil action against the defendant.  She seeks to introduce the witness’s testimony from the criminal trial.  The witness has moved to a foreign country.","No, because the burden of proof in a criminal action is different from the burden of proof in a civil action.","No, because the parties are not identical in the two actions.","Yes, because it is prior testimony of an unavailable declarant.","Yes, but only if the investor demonstrates that she was unable to obtain the witness’s attendance by subpoena or other reasonable means.",D,,In-Class MBE
Is the letter admissible?,"A defendant is on trial for evading $100,000 in taxes.  The prosecution offers in evidence an anonymous letter to the IRS, identified as being in the defendant’s handwriting, saying, “I promised my mother on her deathbed I would try to pay my back taxes.  Here is $10,000.  I’ll make other payments if you promise not to prosecute.  Answer yes by personal ad saying, ‘OK on tax deal.’”","No, because it is an effort to settle a claim.","No, because the probative value is substantially outweighed by the risk of unfair prejudice.","Yes, as a statement of present intention or plan.","Yes, as an admission of a party-opponent.",D,,In-Class MBE
Is the wife’s testimony admissible over the plaintiff’s objection?,"A plaintiff sued his insurance company for the proceeds of a casualty insurance policy covering his 60-foot yacht, claiming that the yacht was destroyed by an accidental fire.  The company has denied liability, claiming that the plaintiff hired his friend to set the fire.  In the hospital the day after the fire, the friend, who had been badly burned in the fire, said to his wife, in the presence of an attending nurse, “I was paid to set the fire.”  Two weeks later, the friend died of an infection resulting from the burns.

At trial, the insurance company calls the wife to testify to the friend’s statement.","No, because the marital privilege survives the communicating spouse’s death.","No, because the statement was made after the conspiracy ended.","Yes, because it is a statement against interest.","Yes, because it is a statement by a coconspirator.",C,,In-Class MBE
Are the memoranda admissible?,"A hotel sued a motel for infringement of the hotel’s trade name.  To establish a likelihood of name confusion, the hotel offers a series of memoranda which it had asked its employees to prepare at the end of each day listing instances during the day in which telephone callers, cab drivers, customers, and others had confused the two names.","No, because they are hearsay not within any exception.","No, because they are more unfairly prejudicial and confusing than probative.","Yes, because they are past recollection recorded.","Yes, because they are records of regularly conducted business activity.",A,,In-Class MBE
Is the detective’s testimony admissible?,"A defendant has been charged with drug trafficking. Prior to trial, a woman who intended to testify against the defendant was savagely attacked and left comatose.  At a pretrial hearing, the prosecution called the defendant’s neighbor, who testified that the defendant said he was no longer worried about the woman testifying because he “took care of her.”  At trial, the prosecution has called a narcotics detective to testify to the woman’s formal statement to the police, which detailed the defendant’s role in a large-scale drug trafficking operation.","No, because the testimony is hearsay not within any exception.","No, because the testimony violates the confrontation clause.","Yes, as a prior identification of the defendant.","Yes, as a statement against a party who caused the declarant’s unavailability.",D,,In-Class MBE
Is the testimony of the witness concerning the victim’s statement admissible?,"A defendant was charged with aggravated assault.  At trial, the victim testified that the defendant beat her savagely, but she was not asked about anything said during the incident.  The prosecutor then called a witness to testify that when the beating stopped, the victim screamed: “I’m dying—don’t let [the defendant] get away with it!”","No, because it is hearsay not within any exception.","No, because the victim was not asked about the statement.","Yes, as a statement under belief of imminent death, even though the victim did not die.","Yes, as an excited utterance.",D,,In-Class MBE
Is the neighbor’s testimony admissible?,"A defendant was prosecuted for murder of a man whose body was found one morning in the street near the defendant’s house.  The state calls a neighbor to testify that during the night before the body was found he heard the defendant’s wife scream, “You killed him!  You killed him!”","No, because it reports a privileged spousal communication.","No, if the wife objects on spousal immunity grounds.","Yes, as a report of a statement of belief.","Yes, as a report of an excited utterance.",D,,In-Class MBE
Is the photocopy of the plaintiff’s hospital chart admissible?,"In a medical malpractice suit by a plaintiff against his doctor, the plaintiff seeks to introduce a properly authenticated photocopy of his hospital chart.  The chart contained a notation made by a medical resident that an aortic clamp had broken during the plaintiff’s surgery.  The resident made the notation in the regular course of practice, but he had no personal knowledge of the operation and cannot remember which of the operating physicians gave him the information.","No, as a violation of the best evidence rule.","No, because it is hearsay within hearsay.","
Yes, as a record of regularly conducted activity.","Yes, as recorded recollection.",C,,In-Class MBE
Is the friend’s testimony admissible?,A defendant is on trial for robbing a bank in State A.  She testified that she was in State B at the time of the robbery.  The defendant calls her friend to testify that two days before the robbery the defendant told him that she was going to spend the next three days in State B.,"No, because it is hearsay not within any exception.","No, because it is offered to establish an alibi by the defendant’s own statement.","
Yes, because a statement of plans falls within the hearsay exception for then-existing state of mind.","Yes, because the statement falls within the present sense impression exception to the hearsay rule.",C,,In-Class MBE
Is the witness’s testimony admissible?,"A defendant, the mayor of a city, ran an illegal gambling business with his ruthless business partner.  The defendant was charged with dishonest and fraudulent dealings in violation of a federal statute and conspiracy to obstruct law enforcement.  At trial, the prosecutor called a witness, a secretary working at the police department.  The witness intends to testify that an investigating officer told her that he was afraid to arrest the mayor’s business partner because certain officers had been punished for arresting members of the business partner’s operation in the past.","No, because it is hearsay not within any exception.","No, because the statement was not made while under the stress of a startling event.","Yes, as a statement by the officer of his then-existing emotional condition.","Yes, provided that the officer is unavailable to testify.",C,,In-Class MBE
Should the court admit the statement from the report?,"A plaintiff has brought a civil suit against a defendant for injuries arising out of a fistfight between them.  The day after the fight, a police officer talked to the plaintiff, the defendant, and an eyewitness, and made an official police report.

At trial, the plaintiff seeks to introduce from the properly authenticated police report a statement attributed to the eyewitness, who is unavailable to testify at trial, that “[the defendant] started the fight.”","No, because it is hearsay not within any exception.","No, unless the entire report is introduced.","Yes, because it is an excerpt from a public record offered in a civil case.","Yes, because it was based on the eyewitness’s firsthand knowledge.",A,,In-Class MBE
Is the woman’s testimony concerning her husband’s statement admissible?,"A woman sued a neighbor for shooting her husband from ambush.  The woman offers to testify that, the day before her husband was killed, he described to her a chance meeting with the neighbor on the street in which the neighbor said, “I’m going to blow your head off one of these days.”","No, because it is hearsay not within any exception.","No, because it is improper evidence of a prior bad act.","Yes, because the neighbor’s statement is that of a party-opponent.","Yes, to show the neighbor’s state of mind.",A,,In-Class MBE
Is the transcript of the friend’s unsworn interview with the detective admissible?,"A defendant has been charged with murder.  The defendant has pleaded not guilty, claiming that on the night of the murder, he was visiting a friend in a neighboring town.  During the investigation, a detective interviewed the friend.  The friend informed the detective that he and his wife hosted a dinner party at their home on the night of the murder.  The friend stated that the dinner party was attended by the defendant and the friend's sister.  The friend further stated that the defendant became intoxicated at the dinner party, so the friend took the keys to the defendant's vehicle to prevent the defendant from leaving.  Soon after the interview with the detective, the friend died.

Prior to trial, the defendant properly notified the prosecution of his intent to introduce the transcript of the friend's unsworn interview with the detective at trial.","No, because it is hearsay not within any exception.","No, because its admission violates the Sixth Amendment confrontation clause.","Yes, because the friend is unavailable to testify.","Yes, under the residual hearsay exception.",A,,In-Class MBE
Is the witness’s testimony admissible?,"In an automobile collision case, the plaintiff introduced evidence that a bystander made an excited utterance that the defendant ran a red light.  The defendant called a witness to testify that later the bystander, now deceased, told the witness that the defendant went through a yellow light.","No, because it is hearsay not within any exception.","No, because the bystander is not available to explain or deny the inconsistency.","Yes, as impeachment and as substantive evidence of the color of the light.","Yes, but only for the purpose of impeaching the bystander.",D,,In-Class MBE
Is the letter admissible?,"A plaintiff sued her employer, alleging that poor working conditions had caused her to develop a stomach ulcer.  At trial, the plaintiff’s medical expert testified to the cause of the plaintiff’s ulcer and stated that his opinion was based in part on information in a letter the plaintiff’s personal doctor had written to the plaintiff’s employer, explaining why the plaintiff had missed work.  The plaintiff offered the doctor’s letter to prove the cause of her condition.","No, because it is hearsay not within any exception.","No, because the plaintiff’s doctor is not shown to be unavailable.","Yes, because it was relied upon by the plaintiff’s medical expert.","Yes, under the business records exception to the hearsay rule.",A,,In-Class MBE
Should the demand for the attorney’s fee records be upheld?,"A defendant is on trial for tax evasion.  The prosecutor, seeking to establish the defendant’s income by showing his expenditures, has asked the defendant’s attorney to produce records showing only how much the defendant had paid his attorney in fees.","No, because the records are protected by the attorney work-product doctrine.","No, because the records are protected by the attorney-client privilege.","Yes, because it calls for relevant information not within the attorney-client privilege.","Yes, because the attorney-client privilege cannot be invoked to conceal evidence of a crime.",C,,In-Class MBE
Is the psychologist’s testimony admissible?,"On trial for murdering her husband, a woman testified she acted in self-defense.  The woman calls a psychologist as an expert witness to testify that under hypnosis the woman had described the killing, and that in the psychologist’s expert opinion the woman had been in fear for her life at the time of the killing.","No, because it expresses an opinion concerning the woman’s mental state at the time of the killing.","No, because reliance on information tainted by hypnosis is unconstitutional.","Yes, because it reports a prior consistent statement by a witness (the woman) subject to examination concerning it.","Yes, because the psychologist was able to ascertain that the woman was speaking truthfully.",A,,In-Class MBE
